id,sentimen,tweet
2561,1,udah 2 tahun lebih ini lip palette wardah awet banget bahkan kehidupan percintaanku aja ngga pernah yg seawet ini
2562,0,iya abis sudah ful pendakinya beh sedih kali mba bro â¾â½â¾â kayaknya gagal lagi nih naik main air lagi saja deh
2563,1,selamat tahun bulan ya sayang semoga makin segalanya ke aku ya cantik i love you so much ï½ ï½ ï½ ï½ ï½ ï½
2564,1,jika kita mencintai seseorang berusahalah untuk tampil apa adanya karena cinta sejati selalu dapat menerima kelebihan dan kekurangan kita
2565,0,foto bareng di pernikahan teman bareng pakboss juga ngeliat si mas makin kurus dan kelihatan sdg sakit selang 2 bln chat dia perihal kerjaan and he said lagi sakit dan dirawat di rs
2566,0,katanya sebelum lambat 6 bln bisa perpanjang sim dimana aja sy ke mobil sim ga bisa mana harus keluar kota lg kemarin sebelum lebaran selalu ga kebagian kuota
2567,1,alhamdulilah punya ayah yang perhatian
2568,1,itu pacarnya dede cakap benar hahaha c
2569,0,iya kan tadi saya jawab terus kamu bilang salah _
2570,1,alhamdulilah kuat d kuat kamu haha jackotwentyone bu kasihani bu belum makan hari â
2571,1,dimsum kwetiau kebab enak kali yaa 3
2572,0,di instagram hits hype parah terkece lah followers banyak cakep cakep lagi bikin story rajin tapi giliran stok foto dia abis larinya ke gue ngajak hunting sana sini kan anying ya lu pikir gengsi dibawa mati
2573,1,ternyata kepo itu seru wkwkwk d
2574,0,klikbca seringkali susah dimaksud termasuk skrg kalau dijawab internet saya bermasalah saya akan bilang itu omong kosong krn saya ga masalah buka website lain
2575,0,rada ksel juga ya stiap mau expo pasti h1 yg dpnya klo gt mah boro mau brangkat psen tiket aja mals atau nggak yg gni udahh d malang beb aku isi ya dp skrg rasanya pngen gw jotosin palanya
2576,0,buset itu cewek sombongnya parah banget
2577,0,spion standar cat di kap nya agak aneh ya
2578,0,haha siapa yang cemburu sama kupluk si ko cie kupluk saja tidakusah cemburu ama kupluk beb hem
2579,1,dan kalau tuhan sudah berkehendak dia bukan yang terbaik maka tingalkanlah
2580,1,gue sama sekali gak tau awalnya kayak gimana yang jelas saat itumakin lama gue makin sayang sama lu gue bilanggue sayang lu itu sebagai temen deket butsetelah dipikir pikir lagigue tuh sayang sama lu more than a friend
2581,1,how i adore u everyday sayang betapa u melengkapkan i setiap kali kita arguement itu bukan la arguement tentang siapa lebih baik tapi tentang siapa lebih sayangkan siapa terima kasih kasih sayang u buat i terharu
2582,1,walau ramadhan menyebarkan energi kebaikan harus lebih semangat dibandingkan sebelumnya terima kasih untuk pln batam
2583,0,babay 85d semoga kalian jadi anak yang bandel yah
2584,0,huahahaha bukan kocak ï½aï½ tapi konyol ï½eï½ juga sneng kan bz tambah basoy punya ï½ ï½ âº cont
2585,0,kamu tuh suka munafik padahal sering liat aktivitas aku mirip gimana tapi tidakpernah mau nyapa duluan
2586,0,nah maksudku yg dilecehin verbal kayak awak dan mbak via vallen aja bisa semarah dan semalu itu apalagi yg udah sampe tahap diperkosa ya makanya biar ga sampe tahap akhir itu siapapun emg hrs berani speak up mau sekecil apapun tindak pelecehannya biar pelaku2 pd mulai mikir
2587,1,allhamdulilah bertambah usia lagi jagoan kecil semoga sehat selalu dalam lindungan allah swt amiin sehat terus nak uchi_ciyko zidanelhadadi palu
2588,1,alhamdulillah akhirnya bisa kumpul tapi sayang belum semua semoga ad wkt yg bisa mempertemukan kita semua aamiin indramayu punya
2589,0,sakit memang melepas orang yang kita sayang namun jangan salah jauh lebih sakit kalau kita bertahan dengan orang yang salah ouw 3
2590,1,lagunya taylor swift yg twenty two emg keren banget deh 3 aah nyanyi lagi ahh
2591,0,sudah jawabannya sama no hpbillingnpwp dll tidak terdaftar bagaimana mungkin belum terdaftar wong saya mendaftar di kantor bpjstk di menara jamsostek kok dan mengapa pakai tokopedia bisa pakai tokopedia kena biaya admin
2592,0,cari duri yah saya sudah tahu akan sakit masih saja diterusin
2593,0,aku gajahat kaka huh jahat sekali sih kalian_
2594,0,ngaca saja dulu
2595,1,walaupun kita jauh secara fisik kita tahu kita selalu bersama walaupun kita tidak mengatakan aku cinta kamu kita tahu kita mencintai satu sama lain walaupun kita tidak mengatakan kita satu kita tahu kita adalah satu
2596,0,haha najis kamu kali peng yang suka d
2597,0,awas saja kalau sampai bikin kecewa susunan member di pertunjukan perdana matahari miliku ini adalah kejutan kirakira
2598,1,yaa tdk apa2 konteks sy bkn bnr dn tdk bnr tp inilah sbuah proses penyempurnaan terus mnerus hg sampai ke tuj bangsa yg diinginkn makmur sejahtera ol krn itu shrsnya kita smua sepakat dn konsen
2599,0,wey anjenk kamu nanda adalah makhluk sejenis jomblo yang kesepian dan sangat suka bermunculan di twet twet orang
2600,1,saya doain makin pintar kamu
2601,0,anak zaman now lulusan aja pake toga segala un di aula2 mahal lah kita dulu lulus sd paling banter perpisahan ke cibodas or anyer naek bis
2602,1,aku tak mudah untuk mencintai aku tak mudah mengaku ku cinta aku tak mudah mengatakan aku jatuh cintaa senandungku hanya untuk cinta tirakatku hanya untuk engkau tiada dusta sumpah ku cinta sampai ku menutup mataa biarlah seperti langit kau pandangi setiap harisesak tak bisa dimiliki aku biarlah seperti langit jika suka kuberikan senja jika duka kuberikan nestapa
2603,0,man teman yang terhormat bisa ngga kita kumpul tanpa hp buat apa kumpul bareng tapi asik sendiri kalo gitu mending dirumah bae nahan boker
2604,1,sy bikin charity free iftar in the hospital bareng temen2 alumni alazhar menganti gresik gerakan kasih menu buka puasa bt keluarga pasien di rumah sakit kita tambahin dgn senyum dan saling doain sesuai kewajiban kita sbg muslim masih terima donasi ya rek
2605,0,wah ini sudah keterlaluan gaes mosok anak2 dibawa bawa ke politik dan ga jelas lagi malah cenderung ujaran kebencian dan fitnah mohon ceck dong
2606,1,coba cek dulu wit barcodeny nga untung saya tidakmatre haha
2607,1,mau ngucapin happy birthday yg ke 24 buat de nursehah smoga berkah umur amp
2608,1,alhamdulilah untung mama baikâ
2609,0,ãïã nunggu busway kek nunggu beras raskin lama jahannaamm httptconp4lzubcmi
2610,0,mau tau rayuan cowo kadal wkwkw kamu cantik kok ngga blm pacar sih kamu suka lagu apa nanti di nyanyiinnanti lagunya aku mainin di spty kamu tuh manis deh bibirnyaaku suka bibir kamu bgitu lah udah basii abis tau
2611,0,kenapa ya ugmcantik ugmtampan tp ga ugmjuara ugmberprestasi kan kalo fisik itu udh dari tuhan kalo prestasi kan diusahakan protesdewe
2612,0,dulu wa isinya kalimat manis peredam penat penyembul semangat mood booster sekarang gombalannya hilang diganti omelan versi digital bos yang suka pedes dan bikin trauma buka wa
2613,0,njir dada sebelah kiri sakit
2614,0,gue bukan antrinya sih ya tp nunggu tanda tangan wadek akademik ini masyaallah bget yak blm lg kalo elemen2 yg tempat berurusan udah dtng ya apalagi ini bln puasa dtng telat pulang cepat hmm
2615,1,sejujurnya masih sayang aku tak pernah buang kau jauh dari hidup aku nama kau tak pernah terpadam dalam hati aku
2616,1,makasih mba novitasarilaras sudah service macbook di auditorium nurcholish madjid universitas paramadina
2617,0,yang bilang kalau ig biasanya cuma ngupload yang baik aja yaah kali pas ngrampok bank live selingkuh live tewtew upload nanti kalau terkenal terus ig di blockir menhub
2618,0,ketika indosat menjadi indoshit
2619,1,akhirnya bisa santai juga o at
2620,1,walaupun kalah tetep seneng ngeliat timnas langsung di gbk
2621,1,senang ikutan seminar mba semangat alhamdulilah jzklh sudah hadir de
2622,1,matur nuwun pak heru sudjatmoko atas pengabdian dan pelayanan panjenengan terhadap jawa tengah semoga selalu diberikan kesehatan umur panjang dan sukses selalu kagem panjenengan tegaklurus satukomando
2623,1,mari kita marakkan ramadhan adalah bulannya milad al quran karena kita tidak tahu pasti kapan mulai turunnya wahyu yang dibawa oleh malaikatnya untuk disampaikan kepada nabi muhammad saw
2624,1,hah kaka baru mandi mandi cantik duyu
2625,0,mantab dingin begini ngopi gorengan
2626,0,paling males gini nih kalau kesalon lama keode
2627,0,langsng ganti chenel itu rcti film nya malam jumat malah film dewasa yang di tayangin _
2628,0,udah mirip ama sodara anjingnya lu cuuk jancuk hahahaha itu pribadi bukan golongan tagih gih ama orangnya hahahaha bonekselamanyajancok
2629,0,dan beres nih aku cari kan siapa tau jatuh tapi da ga mungkin karena ga gedebuk jatohnya gitu kan aku cari cari cari ga pedahal aku tuh posisi ngga pindah pindah depan kaca aja udah hh why sih kesal
2630,0,haha najis
2631,0,males sekali saya ah si afra nih segala pikun dasar si nenek males saya kalau mengerjakan sendiri kalau ber2 masih mending temenya_
2632,0,kaki lemas badan pegal hidung tersumbat kepala super berat tangan pegalpegal apa apan ini
2633,1,selamat berbuka puasa bagi yang menjalankan
2634,1,abis sahur sembahyang subuh balek tidur lagi bangun jam 630 dan sampe ruangan jam 7 kurang 5 menit sptinya saya harus mengapresiasi diri sendiri krn dpet mandi seragaman pake bedak sm gincu dan berjalan dlm waktu 25 menit
2635,0,cemburu kenapa men tidakcemburu w tapi cuma jelous hahaha cemburu gthu saja cmburu haha
2636,1,tote bang bagus dan berkualitas dapat di pakai selama sampai tahun
2637,0,knetz emang gitu klo ngebash suka ga pake mikir deh
2638,0,ikhlas yaa iyaa buk jawaban itu yang keluar dari mulut kami pada saat itu walau samar namun masih terdengar kami kembali ke kamar kami untuk kemudian diam dalam pikiran masingmasing
2639,0,kok gak tertarik pdhal enak loh gajinya besar dpt tunjangan uang pensiun dll kok munafik sih ahh bego lu jdi orang terus mau jadi apa dong
2640,0,males saya di kamar sendiri melongok sendiri kaya orang bego
2641,0,sebel bet sama pak sekdes ribuut minta dikirimi foto batik pas udah dikirim malah ga dibuka __ 3 2 1 males banget mau buka 47 chat yang lain terlalu banyak
2642,1,duh keren n matap ama dulur2 yg tiada hnti utk sayangi bumi smoga ditularkan didaerah seantero nkri
2643,0,haha makanya jujur ay jangan bohong haha jangan satu bohong di jual lagi hayo
2644,1,1thn aku memang jauh dari mereka tapi aku tahu bahwa doa mereka slalu bersamakuu cinta mereka yang membuatku bertahan di tanah yang jauh dan asing
2645,0,nelfon cs disuruh tunggu untuk buat pelaporan 7 menit and still go on tanpa kabar dari cs cuma disuruh tunggu ngapain lama banget aneh
2646,0,sekedar mengingatkan juga mas mungkin cari tahu apa penyebab dollar terus melambung sebelum kasih statement yg menggiring opini seperti ini
2647,1,oma dokter dika tolong pasangin gocar buat saya pulang ya downloadin aplikasi gojek sampe oma dapet gocar dan pulang selamat sampai tujuan happily ever after
2648,0,yang ingin pergi lepaskan saja menahanya akan buat dia tidaknyaman
2649,1,tapi yah aku tuh suka namjoon bukan karna makin sini makin cakep tapi karna personality sama talent dia jugakalo yg belum jatuh cinta sama namjoon coba tonton solo vlive dia yang pake pajama ryan kalian pasti akan jatuh cinta sama bapak yang satu ini
2650,1,bersyukurlah pacar kamu masih cerita ke kamu itu artinya dia sayang sama kamu bikin pacar kamu senyaman mungkin sama kamu dengan cara kamu sendiri jgn cemburu buta
2651,1,semoga lebaran tahun ini banyak memberikan kegembiraan ungkap menpar antusias dan dengan harapan tinggi akan program ini bazarpesonamudiklebaran genpitng
2652,0,tidakkuat rasanya tapi aku harus berusaha lagi
2653,1,oh my god sudah sesuai sayang malah lebih bagus dari punyaku aa anak kitaa d nangis bahagya
2654,1,amin selamat pagi anda adalah seorang yang hebat semoga bergembira
2655,1,aku tau berdoa itu bisa kapanpun dimanapun tapi dasarnya aku kangen terus jadi aku mau usahain tiap minggu ketemu papalove you so much daddy sayang papaa bersyukur pas papa masi hidup papa sama aku slalu sayang2an ngomong sayang cinta ya kita bkn lewat medsos doang
2656,1,met tidur say mimpi indah yh tidur dalam belaian dn pelukan hangat akan membuat tidur mu nyenyak
2657,1,sekarang baru ku mengerti teka teki mu kalimat indah tak pernah ku sadari tulismu ku tak menyangka jatuh cinta semudah ini kepada sahabat baru ku
2658,1,yes terima kasih ani besok ya li thanks ani sayang im god âº hehe how
2659,1,inget jaman sd sekitar kelas 34an tiap pulang sekolah pasti mampir ke rumahnya buat main dan nonton meteor garden sama mamahnya ikut mandi sama makan juga baru pulang kalo udah di telepon mamah haha
2660,0,musim kemarin dapat ucl musim ini dapat europa league tapi jangan sombong dulu
2661,1,waktu itu kami bertiga puluh dipilih dari sekitar 300 orang yang mendaftar ya gimana ga berasa bangga workshop kami diajar oleh fajar arcana agus noor dan semo gumira ajidarma workshopcerpenkompas2015 tsygmc foto masih
2662,0,yah persija vs persib dibatalin payah ah
2663,0,ini kenapa jadi kesannya jadi via vallen vs persija sih ini wanita vs sexual harassment oii jgn malah bikin kesannya persija dukung sexual harassment simic emang ngawur dan layak dapet ganjaran tapi gue yakin karir bolanya ngga bakal ke ganggu uno aja tetep jd wagub kan
2664,0,perasan kaya yang mangil2 nama saya eh ternyata di tv
2665,0,dari mau tdr tidur sampe bgn tdr kok yaa kayak ngerasa aneh ga enak hati udah dibawa istighfar masih aja bgn tdr kayak sedih kayak mikir ga puguh ini knp bgt coba
2666,0,blio juga yg kasih pernyataan ofensif ke menag pas lagi rapat dg dpr ttg travel agent umrohhaji well ketauan lah ya seperti apa kapasitasnya
2667,0,rejimpanik ulama kami kalian kriminalisasi saudara kami kalian bacok rumah sahabat kami kalian lempar bom mobil bunda kami kalian bakarmaunya apa sih kami tidak akan takut apalagi mundur 2019gantipresiden
2668,1,park woojin harus disayang dicintai diapresiasi diberi makanan enak diberi pelukan hangat diberi kopi panas atau cokelat panas terserah dia deh yang penting dia bahagia pokoknya intinya adalah park woojin harus dibuat bahagia
2669,1,cantik langsung tidur ya kamu balesin mentabnya besok lagi yang minta peje kasih aja coki coki aku sayang kamu baby
2670,0,mending ngusut masalah teroris demi pertahanan dan perdamaian nkri etdah pak gausa bawa2 aparat hukum buat kepentingan politik situ napa btw sesekali nunjukin komentar yg pantes sbg alumni ui pak biar gak dipertanyakan khalayak
2671,1,cakap ka avanya pakai kerudung alimnya kelihatan ka
2672,0,spertinya man of steel biasa aj filmnyaentah knp tiap film superman g bs mledak ky film trilogi dark knight
2673,1,mkasih aji selamat ulang tahun
2674,1,selamat menjalankan sholat subuh âº
2675,0,yg suka makan sirip hiu tenggelamkan tdk bu masa ikan segede metromini cuma dimamam siripnya doang makan bodynya juga dong
2676,0,coba saya begitu mayan kan d sibuk skripsi berat badan ayushita turun kg
2677,0,parah ah kamu mah ah
2678,0,lulusan sastra inggris macam apa yg ngomong bahasa inggrisnya curiga dengan kata curious yg bener kan suspicious uda untung gw ga ngomong delicious yaallah ss gw
2679,1,ahahaha gemes duo dumberku ini asuma ngucapin ulang tahun ke oikawa hshahshahah huhuhu selamat ulang tahun sampahkawaku kangen kamu tp kamu ga muncul muncul lagi
2680,1,jadi happy nya gue tuh justru buat hal yg simple2 sesimple ngeliat panah yang buat nunjukin bensin motor apaansi namanya gerak ke arah full
2681,0,entah ini tempat apa yang jelas banyak bencong
2682,0,sebel banget deh kalo senior kerja yang kek gini teh tauu teiung belom selesai nanya lohudah di jawab untung lagi ga pegang pisau
2683,1,wajar gak kalo cowok nangis garagara nahan kangen soal nya gak bisa sama sekali untuk ketemu hehe lebay gak sih engga dong artinya itu sayang nahan kangen sampe nangis jarang sih gue ketemu yang kaya gitu wkwk
2684,1,percayalahsetiap cobaanpasti di balik itu semua hikmahnyadan menguji seberapa jauh kita berusaha menjalaninya
2685,0,ish sialan sangat punya teman macam kamu hahaha xp
2686,1,hmm ya mungkin seneng kalo dikasih kado tapi kalo buatku dia inget aja tanggal lahirku atau anniv wes bahagia rasane pekaitupenting
2687,1,ketika malam minggu tak lagi menakutkan balet asyik bersama orang2 hebat
2688,1,sungha jung keren abis ddahh
2689,0,mantap tidakbisa tolak itu sih maruk
2690,0,kebiasaan macet bgt sih katanya ibu kota3 gimana sih pak jokowibzztt
2691,0,entah kenapa saya jijik liat cowok pakai skiny jeans ngetat sangat dan menurut saya itu tidaklaki sekali begitu hm taram kan
2692,1,gpp miss kami exols bakalan tetap nunggu kami pasti tau susah payah nya buat datangin exo semagat miss fighting aeris lain waktu dan kita bakalam ketemu uri exo jangan bersedih lagi
2693,1,selamat pagi
2694,1,selamat pagi kamu aku sayang kamu
2695,0,wah inisiapapun presidennya kalau membiarkan kelompok pembangkang pancasila dan nkri hidup di republik ini akan kami lawan
2696,0,ku bingung deh kenapa jadi fans itu harus menjatuhkan idola orang lain sih kenapa ngga damai2 aja kek ngga kerjaan ngejatuh2in orang lain
2697,1,semoga kita menjaga n terjaga sbagai pendukung dua periode yg nggak memalukan ayo kita kuatkan kesatuan utk dua periode pak jokowi
2698,0,kesal tahu teh kenapa harus sekolah siang sih _ sayang bgt_ belum jelas sama siapanya mah kayaknya sama mei
2699,0,tua odong_ iya kaya mario bros ya wkwk
2700,0,sudah ah tidakmau balas lagi saya kesal titik
2701,1,kalo pagi mah nasi uduk mas heheirvanardiant haha lauk setiap pagi tuh yah rt ullandey lontong sayur enakk tuhirvanardiant
2702,1,wartegnya punya money detector keren abis at menara citicon â httptcoydero8qdwi
2703,0,maunya hadiahnya aja khayru ummah perintahnya menyuruh kepada yg maruf dan mencegah yg munkar ogah ibarat pengen kenyang tapi ogah makan
2704,1,rumah adalah tempat dimana segala rasa rindu berpulang tentang raga yang merindukan pelukan tentang kasih yang merindukan sayang tentang rindu yang ingin terpecahkan sejauh apapun kaki melangkah rumah yang selalu menanti kepulangan
2705,0,hidup 10th hidup hambalang hidup ektp hidup pln mangkrak katakan tidak padahal korupsi
2706,0,ya tutup matalah krn pejabat bkn cuma pinter tp tau etika masa dlm satu kabinet main nyerang berani y berani tp etika dmna emg kabinet gundul
2707,1,sini sama aku sahabat pun belum tentu bisa jadi teman setia disat kamu berduka hati
2708,0,masih ya hari gini yg takut tempat pelayanan nya di ambil sama orang lain heii pelayanan itu punya tuhan sapa saja yg tuhan percaya diberikan aneh pake main fitnah dan jatuhkan orang ya
2709,1,disaatku tak berdaya kuasamu yang sempurna ketika ku percaya mukjizat itu nyata bukan krn kekuatan namun rohmu yatuhan ketika ku berdoa mukjizat itu nyata
2710,1,heheh terima kasih dat2 iul ipal o denis eva kalian seru d
2711,1,karena mereka juga bahagiakarena kebahagiaan terdapat ditengah keluarga
2712,1,gika mikha tambayong cantik banget nora
2713,1,walopun alurnya loncat2 tp man of steel mayan bagus kok gue suka tapi gue sebel ama bulu dadanya akangâ â httpstcop94ahvfhuo
2714,0,pak wagubsaya beda politik dgn andatapi setelah anda di bully masalah tong sampah jerman sy prihatin coba hub mas nanti sy presentasikan tentang penanganan sampah scra integreted dan murahkonsepnya sdh sy berikan ppramono anung
2715,1,selamat ulang tahun buat si kembar dan sehat sehat ya salam buat ayah bunda
2716,1,selamat pagi tuhan yesusâ w others at komando lintas laut militer pic â
2717,1,tooss bangett huhu aku kenal suara dia pertama kali pas ostnya man from the star dan itu sumpah aku lgsg jatuh cinta
2718,1,terima kasih udah bekerja keras kasih kita army musik yang berkualitas musik yang keren musik yang inspiratif musik yang menyembuhkan sehat selalu
2719,1,oldmoneygangerasain kalo tlp pake hp paling lama 2 detik krn sblm 2 detik msh gratis setelah 2 detik baru kena pulsa tut tut haloo dmn matiin tlp tut tut angkat tlp drmh matiin tlp trus aja begitu sampe eneg
2720,1,alhamdulillah semoga ini momen yg sangat tepat bagi pak untuk dapat memberikan contoh kepada bangsa ini dan ummat islam bahwa menyambung menjalin menguatkan tali silaturahmi itu akan membawa keberkahan
2721,1,lalu beliau bales ngapain takut tinggal ngomong og hngg si bapak berlalu dan ku masih terkagum sampai saat ini beliau ngga jahat seperti yang tergambar di rangkaian tweetku sebelumnya beliau hanya butuh ku dan temenku ngomong beliau mau tau masalah kita tuh apa
2722,0,min kalau tidak perawatan transjakarta ini bisa seperti metro mini saya tiap hari naik basway ini 60 mobil nya bermasalah
2723,1,cinta takkan pernah berjalan sendirian karena kesetian dan ketulusan yg selalu menuntunnya dan aku punya kesetian dan ketulusan itu buat kamu
2724,1,not only educatedtapi jd lah seorang isteri yg mampu menjadi sahabat baik kekasih dan juga isteri yg baik terhadap suami in shaa allahniat nuhaa yg baik tu akan dapat petunjuk dr allah swt
2725,1,beliau disana mendengarkan sembari tersenyum sesekali cerita kami terpotong oleh orangorang yang keluar masuk meminta tanda tangannya sampai kemudian berujung pada satu inti boleh tidak pak kita berdua ujian duluan dan beliau tertawa tapi masih berwibawa dan teduh
2726,0,pemerintah pusat berusaha mensejajarkan bangsa indonesia dg bangsa org malah berusaha menurunkan derajat bangsa jd bangsa pengemis dan pemalak
2727,0,tidaktahu mak terakhir2 ini sering sakit kepala sih belum periksa lagi sudah disaranin sih tapi nanti saja mak âï½ â ï½â
2728,1,hati saya dipenuhi cinta kepada kau dan biar tuhan mendengarkan bahwa engkaulah yang akan menjadi pendamping ku kelak bila tidak di dunia kau lah pendamping ku di akhirat
2729,0,ini kucing dari tadu lagi bertengkar apa lagi paduan suara sih x_x
2730,1,mantap pagi2 nasi uduk emak d sendokiran kek orang bener
2731,1,alhamdulilah min jadi juga main k pondoknya senang kangen aduh campur aduk deh jadi ingat masa2 waktu mondok d
2732,0,aku pernah ikut kuliah umumnya cara penyampaian dia informatif dan edukatif sih tapi kalo liat yang lagi rame itu hmm ingin berkomentar kenapa sih ga fokes sama profesi andaa ajaah
2733,1,selamat hari buku nasional baru saja beres baca buku berharap dapat pinjeman buku lagi hahaha d
2734,1,sambutlah cintaku duhai sayang cinta kita untuk selamanya biarku sentuh hatimu ini sendiri selamat malam wanita terakhir tak mungkinku kan temu seindah ini sampai bila ku harus menanti untuk kau menjadi milik ku
2735,1,cinta itu aneh semakin kamu berusaha menghapus dia dari hatimu semakin sering dia muncul di pikiranmu
2736,0,ah elah bikin tidaknyaman saja haha
2737,0,baru kali ini ke gancit dan kecewa berat baristanya bikin minum dan rasanya berantakan ditanya baik2 malah melengos ga jelas bikin emosi please yg kamu jual jasa kita ga minta dihormati tp berusahalah utk menghargai org lain
2738,0,habis manis sepah dibuang ngomongnya manis ujungujungnya cuma drama saja
2739,0,mungkin si nalarnya ngga sehat karena fans persija ngga semua penyanyi dangdut itu seronok goyangannya via vallen sopan kok bung
2740,0,4 pas uda dikirim kembali si kurir telp ngeluh dan mager buat nganter ke alamat yg bener malah minta ketemuan di titik yg dia tau itupun dia gamau susah no puter balik hrs searah sama arah kendaraan dia jalan
2741,0,jadi certnya kmren pas ibdah kesaksian sii ibu sudah berkali2 di selingkuhi sama suaminya dan si ibu ttp sabar awlnya sy pkir bodo amat ya dislngkuhin berkali2 ttp diam
2742,0,moon cintars sedi bgt dong udh kek cinta segienam banyak yg matek ngarep si ini nikah sama si ini malah nikah sama si itu sad ending pula
2743,1,gela gelaa masih ga nyangka gue bisa nonton langsung ini berkat mamang mamang warkop yg selalu menghemat pengeluaran makanku
2744,0,muka itu enggak usah dicari bakalan dapat muka kok buktikan dengan kinerja lahh yang onoh cari muka nya sama yang tua2 doang
2745,0,iya sih tapi sumpah lebay soulmate kamu kali us p wkwkwk teman kamu tuh kaya acu wkwk
2746,1,kok ga tempat dulu lagi sih yauda kamu duduk di pangkuan aku aja ah aku malu ini kan tempat rame uda gapapa kok tarik tangannya uda gini aja dari pada kamu diri diri kan ihh kok kamu ngeselin yang penting aku sayang
2747,0,tapi angin2an sih kadang ditindak kadang enggak gak konsisten jd gak fair siapa yg merasa gak fair ya pmlik mbl yg pas parkir di situ terus ditindak kitu sanes
2748,0,asal ngomong dan udah pasti ngawur kasihan pki dijadikan kambing hitam teroos
2749,0,harga sepatu saja 136 jt gimana mau bicara rakyat miskin harga sepatu 13 6 jt itu 6 x rata2 umr bln rakyat masih mau ngomong kemiskinan rakyat
2750,0,anak nevolone marah grgr anton
2751,0,kalo gw sebagai cewektuk ngasih tau jg ke rang orangnih cowok yg suka gampangin cewekjd biar ciwi2 diluar sn yg baik2 waspadakl yg emang suka digituin ya terserah yaorg biasa gak populer juga kok yg bikin sep
2752,1,baru sehari masih beberapa hari ke depan yg lebih padat tapi sangat menyenangkan wish me luck and healthy aja deh buat seminggu ke depan fingers crossed
2753,0,telkom down matek pusing
2754,1,terus dosenny seenak ini diajakin ngomong terharuu ga sih lagi ngobrolin tesis disuruh leyeh2 dulu ini malaikat kok turun jadi dosen sih subhnallah
2755,0,lu sebut bumi pancasila ustadz lu sebut pantatcina demokrasi thoghut otak
2756,0,jaman dulu dipanggil nama sama cewek yg di suka aja udh gemetaran ngalahin tes pantokhir akmil lah skrng kalo ga pap tt katanya ga sayang sadar woyy dia itu cewek yg berusaha mati matian di bahagiain ayahnya jangan lo rusak gtu aja buat nurutin nafsu lo oldmoneygakngerasain
2757,0,soal zonasi memang kontroversi tapi sampai bikin sktm pdhl mampu dan bahkan punya mobil sudah keterlaluan terbayang jika sktm itu jadi sebentuk doa dan disegerakan selain tentu sj pembelajaran buruk buat anak sendiri ttg arti kejujuran
2758,0,fisik sih benarbenar lemah sekali e malu2kan ja ckck
2759,1,selamat malam capai parah _ mari tidur tuhan memberkati o fransiskas
2760,0,waketum gerindrong dongo instagram menghapus secara sepihak karena kalian telah melanggar hukum foto2 didepan kabah itu melanggar hukum
2761,0,si gendut kalau saya yang suruh ogah jalan dasar kebo
2762,0,mati mati bareng saya ah sebal gimana rasanya menghilangkan sebal
2763,1,keren kan iyap manis bet kata2nya sedikit nyindir tapi ngena di jomblo jan di rasain ngenes
