id,sentimen,tweet
804,0,ya ela ni pln kampret bner ngerusak prabot rumah tangga aj mending dganti
805,1,malem ini filmnya bagus2 mulai dari man of steel pas sampe rumah eh ftvnya vino 3
806,1,kata orang semakin lama umur suatu hubungan maka perasaan itu akan memudar kok aku malah sebaliknya ya kayak semakin lama malah semakin jatuh cinta sama dia huhuhu i love you diddy
807,0,orang yang suka maksa juga bikin ilfeel dari awal sering banget kalo ngomong pake kata harus sekarang yang buat dia harus belum tentu penting kan buat kita lagian kenapa juga harus selalu sekarang ngegaji aja kita belum tentu boleh maksa right bhay
808,1,adem sangat disini jadi pengen tidur rasa nya
809,0,yang aneh _
810,1,sayang kak aisyah jugaâº
811,1,oke lagi samasama
812,1,pulsa bapak kok cepat habis yaa gatau pak sambil senyum dalam hati karna berhasil download banyak game di waptrick oldmoneygakngerasain
813,1,makasih eh selamat untuk yang lolos ke babak selanjutnya semangat
814,0,kalo memang gak sanggup lambaikan tangan ke camera aja bro nanti yang jemput pleaselah stop komen aneh2 tentang negara ini anda khan salah satu petugas pemerintah juga tho
815,0,mereka yg jarijarinya jago bgt itu gatau kali ya betapa menyiksanya berjamjam tiap minggu di ruang konsultasi nyeritain halhal yg paling bikin kami ketakutan bahkan cuma buat nginjek kaki keluar rumah
816,0,apa seneng banget ya refreshing seneng banget gitu mencari udara segar lah kalo udah terlaku sumpek disini ya kan mending gausah lebay2 minta pulang kesini kan kita udah ga minta2 dia selalu disini kaya dulu loh
817,0,saya kecewa dengan akulaku udah 4 hari daftar tapi gak di acc kata cs suruh pake nomor baru masih aja gak di acc hari ini saya ganti 3kali nomor masih aja gak di acc apakah udah di tutup untuk nasabah baru
818,1,pagi juga oh begitu yad selamat pgi saja sudah buat qm
819,1,gurindam 12 karya raja ali haji sudah saya baca dari sd jadi bacaan saat belajar arabmelayu ini fenomenal serius harus coba baca seluruhnya
820,1,semalam super random bangets beli tiket ke makassar padahal abis beli tiket baru kepikiran mau ngapain yak di makassar kangen jalan serandom dulu lagi
821,1,alhamdulilah bimbingan selesai tingal prepare buat syuting semangat my team
822,0,jadi dia itu terlahir dengan wajah yang agak kurang enak dilihat gitu loh susah jelasinnya terus dia kalo ke sekolah suka pake helm karena diledekin sama seantero sekolah tapi keluarganya tuh sayang banget sama dia pokoknya mengharukan
823,0,namanya juga kerja a _ harus profesional kalo gak profesional mau makan apa neng cinta gak kenyang neng lebih suka makan daging apalagi yg bakarnya aa
824,1,panjang umur murah rezeki dengan silaturrahmi bukbermendesa
825,1,gimana bunda gak sayang kamu nak kalo kamu semanis ini nanti muncul di mimpi bunda ya bunda seneng dipanggil sama kamu dan cerita cerita sama kamu nak
826,1,lanjut di panoramacantik bareng lia sobat cantik kamu termasuk cewek yang kalau keluar rumah suka pakai sunscreen atau yang cuek aja ya paling cuma pakai jaket doang yahh karena kita kan memang harus melindungi kulit tubuh dari paparan sinar matahari biar gak kusam
827,1,selamat hari buku i want to write
828,1,kamu memang dingin tapi kamu perhatian kamu keras denganmu aku diajarkan caranya jadi wanita yang tidak manja tetap tangguh ah sayang
829,0,trus satu lagi bunda anak asuhnya aku satu lagi hiperaktif jadi suka ilangilang gt ya namanya anak maklum tp capek juga nggk sempet ngerjain kerjaan lainnya klo harus nungguin anak yg satu ini help me
830,0,sialan kalau ngomongyah minta saya cakin kaya tadu siang nih yah minta sangat kan nih sijamblang
831,1,namanya juga udah sayang mau disakitin kaya gimana juga tetep aja maafin
832,0,sejak dulu kala ga pernah minat dgn acara2 sejenis ini acara cuman cengengesan ga mencerdaskan buang2 waktu ga manfaat kok ga malu ya bikin acara kek gituan
833,0,terakhir pea_ kamu lagi pilih duluan salah ege pengen kedepak dari biar ke 104_ wkwkwk harapangi
834,0,miror mblo_ cabal yeh ember ni mblo az_ suram luh kaga nape2 mbl
835,0,ini klo kita yang pose dengan atribut demikian bakal di laknat seindonesia di kata komunis liberal antek aseng cc
836,0,anak setan sudah tidur tngal saya yang tidur
837,0,kasihan tuh pks uda ngemisngemis sodorin namanama cawapres kalau ga di pilih apalagi kalau menitmenit terakhir pilih cawapresnyatamat cawapres pks pilihannye
838,1,oh begitu bagus lah kalau begitu
839,1,sesibuk apapun jika kamu memang penting untuknya ia akan memberimu kabar walau tengah malam pun iya akan menyampaikan kalimat yg sedikit membuatmu lega
840,1,selamat makan karnivora with at pic â
841,0,nyampe kampus mau daftar ujian aika ternyata ga bawa persyaratan sertif daan ga bisa daftar oke lgsg ke bank buat bayaran nyampe bank 1446 pak satpam bilang maaf mba udah tutup asdfgjkl
842,0,min pengajuan reksa dana saya di setujui tgl 2805 kok gk dapat voucher gift card cek email pun tdk ad
843,1,selamat menunaikan ibadah sholat subuh bp presiden dan bp dipo semoga hari lebih baik dari hari kemarin t
844,1,setelah itu kamu marah pada papa dan masuk kekamar sambil membanting pintu dan yang datang mengetuk pintu dan membujukmu agar tidak marah adalah mama
845,0,terima tidaksih kalau nyokap kamu disakitin ayah kamu nah makanya jangan menyakiti cewek
846,1,aduuhh ganteng banget tapi tanpa celana merahmu kok jadinya gimana gituu man of steel pic â httpstcozi10wrxeyr
847,0,satu jam yg siasia itu akhirnya bikin aku berkaca sm diri sendiri berapa banyak waktu orang lain yg udah aku siasiakan ketika aku nggak tepat waktu memenuhi janji dengan orang lain
848,1,modal hahahaha bareng aja bisa jatuh cinta nyaman bisa datang dari hal yang sereceh itu
849,0,buya itu gede susah sekali buat di peluk berbanding terbalik sama yang kasih d
850,0,tapi bahaya juga sih cal kalau gitu amit2 karna kepolosan si ibu sieun kan disuruh motong hayam malah motong sapi goreng bala bala ge teu bisa
851,1,puisimalam apapun alasannya hanya tuhan yang tau semoga kelak akan menerima balasan atas perbuatan nya masing2 kita hanya bisa mendoakan supaya tidak terjadi lagi amin ttd admin sore
852,1,ini sudah adem beyb wkwk
853,1,kenapa rcti filmnya bagus jadi gak tidurtidur _
854,0,tapi dibrosurnya tuh mengugah selera mba3 izi piza kan tidakenak
855,1,cuma yang ngerti cara nanganin aku kalau aku udh ngamuk2 sayang sama aku tanpa nyuruh aku buat berubah jd orang lain sabar pengertian org yang selalu maju paling depan kalau yg macem2in aku
856,0,galau bingung mau ngpain tapi malas mau ngapain
857,0,tuh tahan sakit saja bisa b
858,1,setelah pertandingan pak seno yang biasanya keras dan cuek memyambut kami dengan hangat kalian bertanding dengan hebat ini pertama kalinya tim provinsi kita berada di babak ini pak bangga dengan kalian
859,0,merasa oon ketika tahu sesuatu dan tidak boleh di bicarakan ke orang lain nah kelalaian malah sebaliknya jadi malah merubah siklus dan alur waktu yang seharusnya itu terjadi
860,0,kan umaw mirip wkwkwkwk protes salah tidakprotes pun salah_
861,1,oke mau cerita banyak euh jadi tadi barusan banget abis nonton film lima gratis aku lupa sponsornya siapa perempuan gerakan apa gitu kebetulan temenku punya 150 tiket gratis yang dibagiin di kota bandung wey keren kan ya temenku
862,1,apaa eh sengajanya tu sayang dah baca b ku sayang sudah take note already baby love you unconditionally baby cinta b right and treat my king well arasso kiss sini muahh
863,1,untuk beberapa waktu biarlah kita bekerja sebagai bawahan kelak kita bangun usaha sendiri jadi pengelolanya sendiri jadi bosnya sendiri jadi petani yang selalu bangga dengan usaha sendiri nonelse
864,0,bikin status d sosmed cm ngejelekin pacarnacewek macam apaan itugiliran d beri hadiah di ajak jalan kga d bikin status muntahin ajan
865,0,sekali hehe pakai sangat rtbngt ngelupain mantan itu memang susah apalagi mantan kesayangan
866,1,saking asiknya test organo gak sadar pabrik udah sepi dan kekunci di dalem untung aja masih sinyal buat ngabarin orang kantor udah gitu aja
867,1,enaknya makan yang manis manis
868,0,ya beda goblok via vallen emang dulu doyan goyang seronok tp skg better lah dia jauh dr kata seronok mencoba ngubah image penyanyi dangdut pada umumnya dia jg jauh dr sensasi2 yg negatif kayak kawincerai main film syur dll
869,0,sudah sob tapi nanti senin disuruh balik sudah pulang masih pusing sedikit tapi bodolah
870,0,suka kesel sama fans yang soksokan mengatur soksokan yang paling tahu segalagalanya hey kamu ibu negara bukan cenayang bukan sudah lebih baik diam biarkan dunia ini bersih dari segala macam bacotmu
871,0,lah koalisinya pasti keok siapapun pasangan ahy pasti keok mimpin batalion saja tidak pernah sekarang mau mimpin ri hai pd berpikirlah yg waras
872,0,satu hal yg terburuk dalam hidupku adalah ketika aku tak langsung mengerjakan masalah yang seharusnya aku kerjakan sering aku lakukan padahal jam dinding sudah terus berpindah tunda tunda tunda tunda sampai kau menua tunda laporan
873,1,sebuah aksi spektakuler timnas indonesia mampu mengimbangi timnas belanda di babak pertama d goodjob garuda aku pendukungmu
874,0,gini lho mas amalan nu misal tahlilanziara kubur yasinan di bilang bidah sesat sama kawan kawan terus di jawab kadang sampe dilawan balik disk
875,0,ah payah deh ckckck sudah lupus sudah led no hope awkwk
876,1,wah keren ya dimana yang mirip begitu d pakai baju koko sarung lebih keren d liaitukalia pakaianya diganti jadi
877,1,well prince charles bilang waktu george pertama kali lahir dia seneng banget dan berusaha menjadi kakek yg baik soalnya dulu ngerasa kurang ngejaga william beliau juga sering ngajak george buat menanam bareng gitu pokoknya sayang banget d
878,1,bucin loving with my whole heart cemburuan bahahaha suka protes ngambekan sukanya peluk peluk sama cium cium xoxo kangenan banget lagi chat aja masih kangen
879,0,siang tadi merasa bodoh pengen ke sebuah cafe yang mana tempatnya seharihari gue lewatin klo mau pulang sore pun begitu pengen ke museum macan kirain mah jauh selemparan kolor dari kantor dan kostan pacar hahaha ku merasa dodonk
880,1,acuhkan aja orang yg berkomentar seperti itu team t adalah team penuh dgn member yg bakal memberikan sinar kedepan buat jeikeitei mereka itu kuat tangguh dan penuh warna percaya kelak team t akan berkembang jika bersama sama support antar anggota team kompak
881,1,sayang banget sama sm ya habisnya bisa nemu jaemin coba kalo dulu jaemin ga di rekrut mungkin aku tidak bisa menikmati senyumnya yang indah ciaa
882,1,hahahaha oke sep
883,1,alhamdulilah nasi uduk memang menu sarapan yg mantap
884,0,pelit amad bir sudah sesama teman jam perak wkwkwk
885,0,hai mbak mulut bau dikantorku office boy bahasa inggrisnya mantapp banget terus kenapa rupanya yg diperlukan adalah inovasi dan kemampuan bekerja bkn bahasa
886,0,kenapa perhelatan asian games yg akan digelar agustus 2018 nanti kurang menggema karena para netizen sedang khusuk main tagar politik sukseskanasiangames2018
887,0,iya saya sadar saya tidak dibutuhkan saya sadar kemana saya harus pergi tapi kenapa setiap saya pergi selalu dicari apakah saya hanya diperlukan pada saat dibutuhkan saja
888,0,hati2 geb jakarta keras ï½âï½ï½ tas didpn ye okrt digempet orang terus dibis
889,1,cinta pada negeri yang membuat para pemuda mengobankan dirinya untuk bertempur mati matian di medan perang dan cinta pada bangsa pula yang membuat mereka bersedia melepaskan senjata dan menghentikan pertempuran
890,0,kamu alay tbtb jadian kamu alay sangat keponya cici alay sekali sudah masang nama cowok di bio opi kapan he
891,1,amin mokasih yo enak selamat ulang tahun da ade sukses selalu d
892,1,oke makasih der infonya tadu brusn diselengrakn pokoknya luarbiasa cont
893,1,yang paling ditunggu selama ini ya bukber sd smp temen yang bener bener seru bener bener asik dan bener bener yang lain sma ga se greget itu kecuali anak pasti wkwkwk fix secepat kilat dan no bacod mandiri kalo ikut ya bilang ngga ya bilang bnr bnr oke
894,0,leher kecengklak itu tidakenak yah ï½
895,0,dr minggu kmrn menyebalkan eh hri ini lagi tambahan janjian jam 10 eh lah kok malah jek antri nang bri iki piye to ku kesel deeh
896,1,enak sekali apalagi belin w baksonya d makan bakso yang pedas sangat enak kali ya
897,1,hapy bday adik ku sayang pelita jaya bogor
898,0,betul bersihkan pak kejadian2 yg bikin para bong nyinyir habis2an gub indonesia kita ehh ujung2nya kerjaan gub sebelumnya usut tuntass
899,0,life style perubahan gaya hidup pola makan utamanya yang santai dijalani membunuh tanpa disadari konyolnya mayoritas gak peduli nanti kalau sakit desperate nyalahin genetik atau faktor x
900,1,seru yah film man of steel hihið
901,1,kecerian bersama temanteman baru itu sangat mengasikkan keluargabaru salam gowes republiksepeda mtb_indo bikestable gowesnusantara gowes_holic
902,1,nasip w dan adek w hampir sama kita sama2 ga niat daftar poltekkes hampir mau cabut pas mau tes ngasal isi jawaban gada harapan mau masuk situ ujung2nya keterima cmn gue jurusan kesehatan lingkungan dia kebidanan
903,1,yuuk kita siap2 untuk berihtikaf di malam sepertiga terakhirmudah2an kita mndpt malam 100 bulan karena thn depan blm tentu ketemu lagi dg bulan yg penuh maghfiroh
904,0,bah emak2 saya bukan milf tapi siap2 saja kalau dapat yang jelek d haha
905,0,jangan sengaja menghilang jika hanya sekedar ingin dicarisatu hal yang perlu kamu ketahui bahwa yang hilang tak selalu dicari tapi juga bisa diganti
906,0,jebakan betmen apa jebakan tai kucing ups terjebak arindra nih haha sialan salah bicara
907,0,mon maap bukan mau jadi party pooper cuman itu fakultas disebrang jalan rektorat masi banyak yg nafas hti tulung diciduk dulu bu tengs
908,1,baru selesai operasi alhamdulilah lancar rs mitra keluarga kelapa gading w others
909,0,rt kebesaran seseorang tercermin dari kemampuannya mengabaikan perasaanperasaan yan nggak penting seperti perasaan hampa dan marah berlebihan
910,0,lg rame sexual harassment gara2 via vallen dan bnyk pro dan kontra atas yg dilakukan via yg kontra mungkin hrs nonton 13 reason why sih tuh dmn udh cerita kmn2 mnta pertolongan tp org2 nganggep hal tsb sepele telek
911,0,pln kusutpake mati lampu pula at keyzak castle â httptcohe5przp1gp
912,1,hm si cantik punya twiter ya hehehe
913,1,my baby baik baik baik baik baik anak mamih yang cantik jangan 1440jam engkau tinggalkan mamih ya sayang mamih bisa kering tanpamu love you rien ku sayang
914,0,dear mengenai kejadian ini saya mohon kai untuk mengambil tindakan tegas saya selalu menggunakan jasa ka hampir tiap bulan gambir semarang semarang gambir memohin dengan sangat sebaiknya bapak2 ini menunggu dibawah dan ijin kan penumpang yg turun dulu 1
915,1,rt dominikuswira gila fast and furious 6 keren abis
916,1,have a nice day pagi tort selamat pagi
917,1,apa itu cinta cinta adalah ali ketika dia berbaring tidur menggantikan rasulullah saw di kasur nabi padahal dia tahu bahwa sekelompok orang telah berkumpul untuk membunuh rasulullah saw dia juga tahu bahwa dia mungkin saja tewas di kasur yang sama
918,1,rambut aku kering ngembang dan ikal naturally terus makin parah karena tiap hari banget pake hair dryer jadi kasian aja pengen di treatment akhirnya keratin karena dia hasilnya bikin tekstur rambut bagus dan rapih
919,0,sy ga butuh jawaban yg template kak ini org mana ya kok ga jwabsy udh order dr tgl 28 mei lho dan sampe skrg blom sampe brgny
920,1,kepada jamaah masjid al kautsar dikarenakan nasi tumpeng ayam matang sebelum waktunya maka dengan ini pengajian tafsir masjid al kautsar di ajukan hari ini aya aya waeramadhan berkah
921,1,kece semuaï½ ï½ ï½ ï½
922,0,tau dia di rs ku ucap lekas sehat masbtw ku canggung chat sama laki laki yg lebih tua 10 hari setelah itu dapat kabar kalau si mas masuk iccu ku agak kaget tau kabar beritanya yg mendadak drop begitu
923,1,tft temans temans seru wkwk
924,0,web permata krg profesional program cashback 10rb token pln waktu di klik info masuknya ke program paket kuota data piye iki
925,0,wkwkwk kalau di pikir2 sedih juga palsu semua bhahahak
926,0,sudah biasa tiap malam di cuekin kaya gini mah
927,1,mobilelegendsbangbangid main di brawl langsung saja change memimpin top kill dengan mvp sekaligus emang ini hero ggwp hero baru di normal server ini top lah lebih top soalnya hero mage adalah role kesukaan saya selain hero tank sukanya di skill2 nya itu loh buff lagi deh
928,1,hari yang sangat menyenangkan
929,1,tft nur indah wkwkwk menyenangkan y d
930,1,pengen cerita dari kemaren gak sempet beberapa hari yg lalu tarawih di masjid gak konsen banget posisi lagi apes gimana gak posisi solat di shaf depan mas2 pake sarung trus sarung nya nyeplak pantatnya pas banget ketat kampret pen ngakak tp lagi solat syit
931,0,jadi lokasinya tepat di tengah segara anakan yang tertutup mangrove kalo siang sekolahnya kerendem air laut yang naik jadi anakanak sekolah biasanya pulang copot sepatu mereka miris ngeliatnya sekaligus nampar diri gue pribadi
932,1,hahaha semangat sudah cepat wisuda
933,0,maksud pks cara orang muslim yg meninggal ga usah di shalattin karena beda politik apa ini cara islam berpolitik apa baginda nabi mengajarkan seperti ini masih pantaskah pks di sebut partai dakwah
934,0,giliran sudah deket rumah malah macet gini â¹
935,0,kamu tuh suka munafik padahal sering liat aktivitas aku mirip gimana tapi tidakpernah mau nyapa duluan
936,0,itu pesan masuknya udah sexual harrasement sih dan itu sesuatu yang gak bisa dibilang biasa aja di budaya yang paham patriarki nya tinggi memang hal itu keliatan gak penting tapi coba yang diperlakukan begitu saudari kalian temen atau pacar ttp semangat gita via
937,0,oalah itu pacar kamu kirain tante kamu tua begitu tampangnya
938,1,membuat kita dapat secara tidak langsung menyatakan suatu perasaan yang dalam kepada seseorang memang cinta yang teramat sayang akan memberikan kenyamanan dan ketenangan hati
939,1,terima kasih d nih oranga tidakteman kamu yang puitis sekali
940,1,11 awal pertemuan sama si mantan itu pas wgl pertamanya gamau lanjut aku udah bikin tweetnya bilang makasi dll tapi kayaknya dia ga ngerti jadinya dia nempel terus ke aku yaudah deh akunya juga jadi demen trus jadian
941,1,senyum adalah media paling murah dalam membangun suatu hubungan kintamani photography savana vsco balicili balitrip baligasm bali travelling kintamani bali indonesia
942,0,apa baru nyadar warga aceh biasanya klu sdh kena pd dirisendiri salah satu pejabat yg membuat aturan biasanya kabur duluan korbannya rakyat jelata dipakai sbg kelinci percobaan dulu cui kacian deh loe
943,0,beberapa orang menepatkan dirinya di belakangmu selangkahbukan berarti dia kalahhanya saja mungkin dia menyukai posisi ituyadia suka di belakangmudan kamu terus menatap ke depantanpa tau cinta di belakangmu
944,0,lhahh kok gtu mau dpet duitnya tp ga ngerjain kerjanya org lama pc situ kah ga enak ketua pc nya mentang2 kamu baru digituin ya sabar2 ra senyumin aja
945,1,dan akhirnya saat papa melihatmu duduk dipanggung pelaminan bersama seorang lelaku yang dianggap pantas menggantikannya papa lun tersenyum bahagia
946,1,selamat sore dunia âï½âï½â
947,1,countdown to libur lebaran keknya w mesti donlot banyak drama kan udah lebaran yakaan ga puasa yakaan gapapa kan nonton adegan unyu drama korya yakaan
948,0,parah banget ini macet nya sumpah at tol dalam kota httptco4chldmjgha
949,0,kaya gini mau nyaleg uda dapet korupsi berapa m masih kurang jadi inget ama yg nyolong ampli mushola sebanding ga harga ampli ama yg di korupsi taufik kalau mencuri ampli yg harganya ga seberapa di bakar hid
950,1,puncak spiritual seseorang adalah ketika orang tersebut diberi perasaan malu dihadapan allah swt orang yang beruntung adalah orang yang tahu ukurannya sendiri balikpapan
951,1,tuli pandai mendengar
952,0,kalau belum bisa cari _ sendiri jangan sok deh
953,1,nemuin bacaan yg bikin ngakak di setiap paragrafnya duh suka banget gua sama penulisnya
954,1,paling seneng kalo berobat di bandung sama konsulen bisa sharing becanda lah kalo di bali ngeliat konsulen cuma bisa nunduk sambil senyum kecut
955,0,lagi puasa tp dri pagi udah kesana kemari mmbawa alamat eh ayuting2 kalee enggk ding ini knpa siang2 tetangga sbelah goreng telur yah kan baunya smpe idung gw hikss piye sih mbak
956,0,iya dong ah serius tidakbiasa sangat d di man engak masa rtnursapitri becek dimana mana becek _
957,0,pembimbing itu ruparupa macamnya ini pembimbingku 1 bikin grup wa bimbingan 2 gapernah ngadain bimbingan 3 h2 bulan baru menanyakan progress 4 tidak pernah membacamencoret hanya mendengar dan menyimpulkan kita harus gmn 5 tibatiba blg dateline skripsi minggu ini
958,1,berasa lagi baca fanfict soal chaebol heoll ini di indonesia beneran loh orang yang hidupnya kayak kita nonton cerita di drama korea simak di mari
959,1,entah kenapa di tempat ini sy merasa dekat sekali dgn sang pencipta untuk itu aku selalu ingin mengunjungimu wukir mahendraku
960,1,terkadang duduk termenung juga menjadi suatu kebutuhan apalagi bareng kamu yaa kamu sintasriwahyuni01
961,0,yang ditanyakan lagi nanti di dalam artikel itu terus kalo gak puas bikin deskripsi sendiri di hujat hujat sendiri
962,1,selamat pagi selamat beraktivitas guys
963,0,memang kamu kenapa tapi saja tengsin de saya putus dngan saya yang salah sekali memang
964,0,bercumbu dengan kerasnya ibukota jakartaa yaaâ¹ duh
965,0,ganda bukan kandang saya _ dirama bolanya jelek
966,0,hilangin sifat gengsi gak jelas yang ujungnua cuma bikin capek diri sendiri karena gak mau dipandang lenih rendah atau buruk dibandingkan orang lain gak akan habisnya kalo nurutin orang mending coba buat nerima kekurangan dan perbaiki sampe jadi kelebihan
967,0,nungu panjangnya kan lama rey
968,1,anyong namja romantis itu idaman aku bgt perhatian pastinya sayang bt sama kita bisa humoris juga sukanya tuh kasih sesuatu peluk kita itu ajah deh selamat memilih
969,0,ig minta line dikasih line minta wa kenapa ga sekalian aja minta playstorenya biar udh satu paket ig wa line mobile legend juga
970,1,sukses dandim1621 tts tugas mulia brsama rakyat berhasil nambah kemajuan desa sukses pak babinsa met tugas mulia kian kuat tni brsama rakyat jayalah nkri
971,1,itu bukan kepo kali tapi harapan biar bisa malak haha
972,1,ini baru co berkualitas uda smart a doctor muda handsome sopan pengabdian tuk profesinya keren abis deh top
973,1,cinta sejati bukan cinta yang mengutamakan pelukan ciuman dan pertemuan tapi cinta sejati lebih mengutamakan pengabdian kasih sayang dan perhatian
974,0,apa tdk kata lain yg dipelajari anak2 disekolah ttg cebong berbeda bagi mrk anak2 tanya jadi cebong itu orang ya bukan anak katak
975,0,msh jg bego dia dihukum atau ditembak ga masalah dan ga yg bela nah sibangsat cabul kabur padahal yg bela 7jt org tolol masih ga berani jg balik kenapa kalau waras berpikir pasti kau tau jawabannya
976,0,parah banget layanan busway tidak memuaskan antri di shelter paser baroe aja sampe 1jam
977,1,apan heh cipok oke deh sayong wkwk
978,1,selamat berbuka puasa a pipis alhamdu lilah d
979,0,iya sudah belum dapat susah mau cari siapa lagi ya
980,1,selamat berlomba krar
981,0,serius lho 5ri_rahayu seriuz
982,1,perkembangan teknologi nggak akan habisnya deh semakin lama manusia akan terusmenerus berinovasi bagi teknologi termasuk koneksi internet positifnya hal tersebut pasti bisa membantu dan mempermudah pekerjaan manusia
983,1,yg pernah atau sedang ngejalanin usaha pasti tau lika liku keunikan konsumen prinsip gue selama bisa gue penuhin permintaannya i will do it walaupun bagi gua aneh
984,1,walaupun kita jauh secara fisik kita tahu kita selalu bersama walaupun kita tidak mengatakan aku cinta kamu kita tahu kita mencintai satu sama lain walaupun kita tidak mengatakan kita satu kita tahu kita adalah satu
985,1,alhamdulillah happy mkin aktif nak 8monthdedek nazhiaputriadhitya sehatterussayang cintaudek
986,1,kita berteman beda genarasi asiknya kita yang tua berasa jadi muda dan mereka yg muda belajar membahas halhal serius dalam masa depan kita berteman se asik honorindonesia honor7s meskipun kadang harus mrnghadapi sifat kekanakkanakan mereka
987,0,aduh ini badan sakit sakit kek sekalian jangan stngah2 gini menyiksa
988,1,telkomsel cepat gila ampe loadingnya gakeliatan
989,0,main yo opoy ndud 3 ganguin thats true wah parah kamu ung tidakikut an saya
990,0,hehe kaka kurang ajar kasihan deh loh
991,1,c kak selamat sore semua saya mau ajak nonton bareng film â308ï½ yang tayang juni yang mau
992,0,kalau sudah sibuk masingmasing akan bisa tidakya
993,0,kasihan pasti nungu lama yah terus resulta apa
994,0,tidakada yang enak 2nya mending sakit karena diterapy saja d lebih enakan sakit gigi dari pada sakit hati huhu c
995,1,4 dan bersyukur bgt karena dipertemukan sm partner program yg diselenggarakan oleh laz ymm fi yaitu karantina hafiz quran suasana iftar dan sahur yang menyenangkan dan pasti cerita seru selama karantina dan program radio mari kita bersyukur atas apa yang saat ini
996,0,perasan hari ini kangen capai kesal senang galau iri males
997,1,yah pingin kyk si laudya dpt duda baik punya anak 1 ce dudanya baik sayang sm gw gitu deh fokus gw skrgfight aja n tetep semangat krn gw udah putuskan mau menetap sampe tua n death disana
998,0,1suara untuk 5 tahun jangan harap suara kami jika para dewan mendukung pembubaran kpk lebih baik bubarkan dpr
999,0,memang yeh sony memang begitu kacau dikandang h bareng tapir macan sama monkey hahaha dimana
1000,0,iya di dm lewat twitter gitu tadi sempet selewat ngeliat sebenernya boleh aja minta hapus foto2 konser atau sue kalo mereka ga mau macem jelpi tapi kalo nyuruh tutup sih bodoh sih
1001,0,sama email traveloka terus telfon call center cuman 1 kali karna ga berfaedah sama sekali trus akhirnya ak nyepam di facebook penuh makian sama garuda eh malemnya dah masuk transferannya wqwq tergantung maskapai kayaknya soale sodaraku ref
1002,1,10 im yoona cantik banget buset talented good personality kurang apa kesayanganqu pokoknya udah cinta mati bgt sama yoona
1003,0,hari ini tiap menit terima bm
