id,sentimen,tweet
1607,0,menurut saya prof koruptor itu sama saja dng membunuh generasi anak cucu secara perlahan2 prof saya setuju jika para koruptor kelas kakap di hukum mati dan di miskin kan
1608,1,sarifajraniif cie sari malming nya nonton man of steel pasti keren tuh
1609,1,pagi juga maniso
1610,0,semua warga ntt suka atau tidak tentu banyak diantara kita tak setuju klaim sepihak tak pantas dari di sebagai tuhannya nusa tenggara timururl malah dicaci maki karena berani kritisi timses vblusername amp
1611,0,i want bb ku yang lama balik the bb kepler putih aku cuma mau liat chat history ku waktu kelas 9 cuma mau baca ulang sekali lagi aja gapapa i wan na know what did i miss
1612,0,tidak sepakat dan anda sudah menyesatkan orang lain memang dilarang sholat di dalam bangunan yang didirikan untuk kekafiran salah satunya gereja makanya jangan kebanyakan nonton mak lampir aku berlindung kepada allaah
1613,0,mau sangat apa saja bal rt bohong kagak_rt jgn2 kamu yang buat
1614,0,menyiksa sekali nih batuk nya3
1615,1,jangan bergantung pada peruntungan senang dan tidak happy hidupmu tergantung kerja kerasmu tulus mahakarya lagu kesukaanku biar ga malesmalesan
1616,0,gakgak apansi nutrt kamu tuh nakal dasar anak dajal laknat kaurt
1617,0,gw bilang juga apa kebaca benerr kelakuan lo
1618,0,ya gimana sih yg awalnya gasuka tapi kalo diperjuangin trs jadi rada suka gitu brrti dia beneran ya tapi kalo udah diperjuangin jangan kurang ajar udh diperjuangin eh malah pasif kasian yg merjuangin tuh
1619,0,tidakdi dunia nyata tidakdi dunia maya semua ribut bm ah w mau tidur ah besok mah gimana nanti saja mogamasihpunyaduitbuatbensin
1620,1,aih neng puput nih bahasanya cakap yah jam jam sgini d jadi temanteman intinya adalah
1621,0,sakit apan kok sampai bedrest semoga sakitnya tidakberkelanjutan
1622,0,pln itu ngeselin loh mati nyala mati nyala mulu
1623,0,salah satu contoh tidak tau berterima kasih pdhl datang pas sdh terkenal pi wannaone ckckckc yg dl berjuang siapa jawab sendiri ma ko deh wan na ones swing entertainment warns legal action against fansite masters via
1624,1,terbaik adalah ketika saya berhasil membuat sebuah senyuman walau hanya kecil di bibir elu
1625,0,tidaksiap besok disekolah saya harus gagu seperti agus _ duh sakit
1626,0,yah orang kurang bacot gabuz saja kamu sempak mama kelonin dong tidakbisa tidur nih
1627,0,sakit jiwa nih indosat sinyalnya
1628,0,o salah gebo saya ngeri ama darahrt wkwk salah dong ye gewe pms bilang2 astaga
1629,0,kepala pusing sekali _
1630,0,ya masalah dia mau masuk partai penista agama itu hak pilihan dia yg di sayang kn sbaik nya tdk usah membawa bawa nama allah dn membawa bawa nama hrs tuk k pentingan pribadi
1631,1,jangan kaya gitu lg oke sesusah apapun pokoknya harus bisa tahan diri buat ga nyakitin diri sendiri gimanapun caranya coba lampiasin ke gambar atau nulis pokoknya usahain jangan nyakitin diri sendiri banyak yg sayang sama lo gamau lo kena
1632,0,nene istighfar nene jangan seperti itu saya makin jijik sama muka kamu najis
1633,1,apa tanggapan kalian tentang wanita yang bercadar kagum aja gt di era jaman now gue aja mau pake gamis susah bgt lah dia bisa bercadar gitu dilingkungan yg ga jarang ga mendukung dan nganggepnya teroris
1634,1,sejak awal mengenal dan mencintaimuhati utuh yg penuh cinta ini telah memilih untuk tetap menerimamu bagainmanapun keadaan ini terluka itu pilihandan tetap mencintai adalah anugerah dan kesempatan yg diberikan tuhan
1635,0,askmf makin gue dewasa gue semakin sadar gue punya banyak temen tapi disaat gue kesusahan gaada yg semangatin gue cuy malem ini gue khawatir bgt dan itu mengganggu tidur malem gue but gue hanya bisa pendem dan makin terpuruk aja
1636,1,kaka baik ya kasih kepiting ke ka olga
1637,1,hayuk ah ikut biar ramai liat acara waisak ikut
1638,1,kemarin buku tsygmc ini sempat ditwit oleh mas agus noor untuk tagar bacabukunya seneng gitu liatnya biarpun gue anak murtad dah sejuta tahun lamanya ga nulis fiksi workshopcerpenkompas2014
1639,1,jangan pernah bosan menunggu selama dalam menunggu itu di jalan allah allah pasti akan memberikan kejutan yang tak pernah kamu bayangkan
1640,0,yaelah sabar ya vid sampai lebaran monyet juga engga bakalan ditanggapin cepat ini kalo engga sering diserang dengan follow up tajam langsung ke plasa telkom atau telepon 147 pengalaman sudah sering banget soalnya ini telkom
1641,1,aku gak tau kenapa makin hari aku makin sayang sama kamu aku makin takut kehilangan kamu aku pengen terus bersama kamu hingga akhir waktu ku
1642,1,jokowi_do2 terimakasih atas film yg begitu menginspirasi kita bkn hanya karya pak jokowitp kehidupan bapak jg sangat menginspirasi
1643,0,lo ngehujat dia sama aja lo membiarkan sexual harassment merajalela goblok dilecehin malah suruh marah nolak makimaki ya ga mempan buat pelaku sexual harassment yang dilakukan via vallen mempengaruhi karir si simic ya udah resiko simic lah goblok
1644,1,gantengbangetrt new avatar gimana bagus tidak
1645,0,tay ini cewek seperti bgst pembantu belagu sok bagus sangat susah anak kampung mah wkwkwk
1646,0,maaf ni min paket saya knp lama bnget ya pdhl sy butuh banget ini krn sy ngejar keberangkatan dr kmrn sdh smpe gempol knp ko lama pdhl sy di pasuruan kota
1647,1,suka bgt dgn karena pesertanya luar biasa dpt mengenakkan lagusangat memukau dan bikin merindingjurinya top bgt pokoknyasuka bgt dengan program usernamejuri dan pesertanya memank luar biasa
1648,1,untunge mereka tanggung jawab kasih kaos ganti setelah diguyur air kadi korban keisengan temen2 aisjogja aisjateng_plat_h
1649,1,i am so fall in cinta with this song secara jatuh cinta mendengarkanya ternyata dirilis 2016 dan aku baru tau sekarang
1650,0,dunia itu mirip bayangan badan jika kau kejar pasti ia menjauh namun jika kau menjauh maka ia tidak pilihan lain selain mengikutimu ibnu qayyim
1651,1,risha sayang mas imbuhnya kemudian mendaratkan kecupan singkat di atas bibir arsya dan setelah menarik diri arisha mengulum senyum dan buruburu bersiap untuk pergi
1652,0,alisa bicara seram kan saya tidakcot kaya kamu ya
1653,0,otaknya sudah rusak pola pikir jadi seperti hewan pribadi yang buruk sexophone time
1654,1,iya rebutan colokan pada penuh semua d dibis karokean tuker2an cemilan wkwk
1655,1,superman man of steel film yang wajib di tonton
1656,0,loe mau ngatain gw bencong apa lah terserah loe yg pasti gw gak merasa gw bencong loe lupa yg udah ngewe sama gw giliran gw gak ngeladenin loe lagi loe bilang bencong ehmm kasian bgt hidup loe
1657,1,ha iya donk tenang mah akan aku buat kejutan nanti tanggal bawa yang lain ha
1658,1,mandi enak nih ï½
1659,1,bahagia itu dekat seperti i cinta the way you say good morning so say it every single day to me ya cm mau ngingetin jika satu org sdh mulai pudar kepeduliannya jgn pernah takut krna diluar sana akan org yg lbh peduli sama km as long as you do something good jg
1660,0,kalau kaya gini salah siapa
1661,0,pan sini mau belajar bayar pajak yg bener ya kalo ga tau nanya nanya ya pastilah datang ke kantor pajak ndak dapat pencerahan malah dapetnya emosi kalo males bayar pajak karena ribet tar jadi masalah lagi kan lucu
1662,1,ya pokoknya okta masih sayang elu sudah begitu ya kan punya jalanya masing2 kamu rt
1663,0,orang orang bilang sih yaelah jalanin aja gausah dibawa tegang gitu ya karena orang itu banyak tipe berbeda beda gue tau tipe diri gue ini seperti apa orangnya gampang setres maksimal jadii mendingan kita cegah dari pada mengobati usaha aja doloe
1664,0,si ini ngga bisa seenak dewe melepaskan tanggung jawab ke backers cuma berdasarkan toc antara kickstarter selaku penyedia platform crowdfunding creators dan backers toc tetap tunduk ke hukum yang berlaku di governing law si toc gue mau cari legal loophole nya
1665,0,niatnya sih tidur terus buka twitter eh scroll twitter sampe nggak habisnya iya kaya sayang aku ke kamu ngak habisnya sayangmu ke aku habislah sudah seperti tida pernah
1666,1,15 tahun yg lalu kau hadir di tengah kami menjadi penerus generasi zulkifli cucu pertama laki bagi kakek nya selamat ulang tahun anak papa bayujuli1007 15 tahun umur mu jadi lah laki
1667,1,mama aku adalah wanita terhebat yang kuat mengurus 4 anak dan ngejalanin gimana dari awalnya kami hidup enak tbtb semenjak ayah meninggal jadi berubah drastis mama selalu mentingin anakanaknya dulu baru dirinya sayang mama
1668,0,fyi dan bapak yang tadi ku temuin di stasiun itu dalam kondisi semua badannya dingin mukanya pucat kayanya belum makan dia bawa kantong plastik yang isinya cuma air minum ukurankecil
1669,1,hahahaha mantap y idak labil dak oy aku trust kalian
1670,0,lapar tapi malas mkn_
1671,1,kain batik asli indonesia pahat kayu buat bikin bangku makin asik dan hati bahagia liat yg ayu 8rianna_ penguasa hatiku inisahurtiketcomharike20
1672,0,diblg sakit hati ya pakai sekali mau nangis tapi kalau dipikir2 nga guna nangisin dia jadi saya harus gimana
1673,0,sedih amat _
1674,0,sudah survey ke beberapa cewek yang bilang cowok itu omonganya ga bsa di pegang ternyata mitos gaes dan sekarang si cewek itulah yang begitu jadi yang tidak bisa di pegang omongannya siapa coba kita survey untuk yang ini apakah sama atau berbeda ku rasa pasti sama
1675,1,makasih ya buat semangat dan doanya peluk cium
1676,1,mbak mau bawa barang bapak apa baju bapak tapi nnt tdk bisa dipake mbak kalo baju ya sarung bapak mau sarung aja ya yg biasa bapak pake ke masjid biar kalo kangen bisa dipake ibu ambilkan bu semoga bisa ketemu lagi secepatnya ya cinta bapak di senyum ibu
1677,0,kayaknya muka saya yang aneh deh
1678,1,met ulatah ya sayang nya mana
1679,0,pas w udah punya pacar trus pergi nonton ke bioskop orang lain dih nontonnya sama pacar mulu trus gak ngajak2 nih lah situ kalo di ajak gak pernah bisa pengen rasanya ku sentil amandelnya satu2
1680,1,ka tertawa terus manis sumpah
1681,1,om gabung ke densus88 dong daftar aja sbg penjinak bom daripada mabok lem kan mendingan kerja nyata buat keamanan bangsa
1682,1,cinta mampu melunakkan besi menghancurkan batu membangkitkan yang mati dan meniupkan kehidupan padanya serta membuat budak menjadi pemimpin inilah dasyatnya cinta
1683,0,serba salah yah
1684,0,baru ngerasain nih gue bener2 duit di dompet tinggal 4rb doang di atm tinggal dikit dan gabisa diambil krna saldo ga cukup ternyata gue bener2 miskin yawlaa
1685,1,ritual kalo mau tidur nyanyi lagu sayang kaka ani sayang mamak sayang bapa sayang oppung sayang abang gio sayang tua gio sayang tua winda nyebutin semua anggota keluarga besar namamu selalu duluan disebut dek
1686,0,hahahaha alay kamu ngancem nya ngereport spam segala
1687,1,kayaknya sudah lama sekali tidak mengisi materi dalam acara fortasi tibatiba yg menghubungi dari muallimin untuk menjadi pemateri wah padahal sudah uzur di dunia ipm
1688,0,gregetan kalau nonton tv beritanya korupsi mele _
1689,0,gapercayan
1690,1,sabar ya dinda nanti dipijetin deh sangat mis ini grgr mr dani mau sekali apa mau saja din
1691,0,jaringan indosat tak stabil
1692,1,ketika saya digombali murid saya ibu cantik og bu lalu saya salting dan eumph jawab kamu juga cantik kok lalu emph dibilang masih muda dan saya makin speechless
1693,0,gapapaa gue udah berusaha untuk sblm lebaran dari kapan tau tp dospem malah ke luar negri pas tgl tgl sidang kering sudah air mata ini
1694,0,kadang saya rindu rindu ketika awal kita berkenalan rindu ketika kamu selalu waktu dan rindu canda tawa yg kita ciptakan pd setiap chat ya lord
1695,1,untukumu wanita yg selalu aku fikrikan bahagialah dgn bertambahnya usia mu syng semoga kau sehat semoga terjaga iman dan islammujaga bahagiamu kekasihku maka aku akan merasa tenang krn mencintaimu dlm diamsekali lg selamat bertambah usia aku mencintaimu sampai akhir hdpku
1696,1,wkwkwkw iya2 benar u p
1697,1,jam segini telkomsel lancar d
1698,1,paris indah sekali yampun
1699,0,masalah satu selesai datang lagi masalah baru atau memang saya saja kali ya anak sial â¹
1700,1,tapi seneng juga karna secara langsung merilis mini album pertama rilis 6 april pada waktu perkuliahan semester 6 dan terdapat 6 lagu di dalam ep tersebut this how it works
1701,0,bongan ndi mh rhah tring hadir haha jan marah aku marah sama kamu tidakmampir bilangin juga
1702,1,beli jus enak kayaknya berangkat d
1703,1,uda thr an kan coba sekali2 kl lg mkn warung biasa not resto yg biasa tip ketemu pelayan nya tua n keliatan kasian kamu selipin 100rb kmu liat reaksinya akan luarbiasa dan perasaanmu pun bahagia super sekali 100rb ga akan bikij kita miskin tp berarti bnyk utk mereka
1704,0,sudah berapa kali delcont2nan masak iya mau delcont2nan lagi biar tidaksaling gangu lagi mirip anak kecil saja o
1705,1,alhamdulillah keadilan sosial sungguh merata keseluruh penjuru nusantara
1706,0,ini ya kalian lucu ya masak pas sy orderada lho stoknya kok bisa2nya skrg bilang ga stokloreal pun responnya lambat bgt sy tanya dr tgl 31 dan bru drespon hari ini itupu krn sy tanya lagi gmn sih kalian ga profesional bgt
1707,1,mantab lah makanya pada pintar kimia mantab y efek kimia satu bikin ganteng skarang bikin rambut rontok
1708,0,sinyal indosat di rumah susah sangat
1709,1,ini baru pemikiran professor biar masih junior dibandingkan professor cebong anu yg ini lebih bermutu dan punya dedikasi
1710,1,2010 pertama kali ngetwit muncul setelah friendster yg marak merajalela pada saat itu masa dimana kenakalan remaja berangsurangsur melebur demi meraih cita begitu indahnya saat itu thankyoutwitter harijaditwittersaya
1711,1,kita hadapi hari ini dan besok dengan gembira
1712,0,telkomsel abal handphone abal semuanya abal abal abal abal
1713,1,sehebathebatnya pertengkaran adalah pertengkaran yg akhirnya baikan lagisamasama sayang dan saling gamau kehilangan sahabat
1714,0,pernah tidakkamu bela2in jalan sama pacar padahal kamu lagi sakit
1715,1,tari pasambahan kenapa keren banget selalu takjub ngeliatnya
1716,0,hahaha iya sih tidakgangu kan mi saya canda kok mi jangan marah yah cumi
1717,1,3 bau nya ndak amis dan masih bersih 4 klo belanja di tpi dpt ikan ato cumi2 yg masih baru dan besar2 trus harganya bisa ditawar 5 klo ketemu nelayan bisa beli ikannya selain di pasr ikan yg harganya jauuhh lbh murah
1718,1,amin haha maci ya anyisâ selamat tahunan ya semoga ketemu sama taun taun berikutnya hap
1719,0,warga masyarakat singgahan tolak segala bentuk hoax dan mendukung pilkada damai tolakhoax lawanhoax pilkadadamai2018
1720,1,tuhan tidak memberi kita hati dan mulut untuk mengeluh dan mengomel malainkan ia mengajari kita untuk bersyukur melalui hati dan mulut kita selamat siang sahabatku
1721,1,respon positif dari persib seperti ini yang diharapkan dari tim sekelas persib semoga tetap konsisten persibday persibsalawasna persiblive psmsvprsb liga1kitasatu
1722,0,sakit tidakpakai bong nyentuh sekali malah apalahitu
1723,1,saik gancil gampil gampang wkwk sebentar gampil di jabrik2in ye cont
1724,1,terima kasih sudah tertawa semoga menjadi amal soleh dibulan mulia bisa membuat sesama hambanya ketawa bahagia
1725,1,jangan lupa bahagia hari ini cukup jalani hidup dengan penuh bahagia ketika hal yg buat kamu sedih senyum harus senyum angkat kepala biar mahkotamu tidak jatuh
1726,1,sukses deh buat lo ï½ alhamdulilah sehat juga baik tik alhamdulilah kamu sehat ï½
1727,0,yaallah telkomsel pagi2 ko ngajak gulat ya
1728,1,ga bosen ketopraknya enak kok at ketoprak cimeng pondok kelapa topcims httptcocxqqn8v5b4
1729,1,pastinya donk semangat ya feminis muda belajar ict nya olvyt
1730,0,tibalah kita di penghujung persimpangan di penghujung jalan cinta kita berdua terpaksa ku relakan tak daya ku halangkan kerna ku tahu cintamu bukan lagi milikku
1731,0,tiba stiap orangbegitulah kelihatannya mnjd ahl tentang islam dari presiden perdana menteri sastrawan picisan seolah smua siap memberikan kuliah ttg apa sbenarnya islam itu jk pengetahuan tsb bgtu mudh utk diperoleh mjd sangat aneh bahwasanya opini yg sngat salah meluas
1732,1,traktir dong mih hahahaha thank you monol mis you to nol
1733,0,pak kalo ga punya malu at least ngrasa punya dosa lah takut sama tuhan hee pak di jepang koruptor langsung nebas diri sendiri pake samurai di korea langsung sujud di depan khalayak umum mengundurkan diri saat itu jg gapake lama disini jd
1734,1,keberanian terbesar seorang lakilaki adalah pada saat ia berani datang ke rumah gadis yg disukainya kemudian duduk berhadapan langsung diantara suguhan kopi
1735,1,alhamdulillah goal suport unit penyambutan ri 1 semarang peresmian terminal baru airport a yani semarang tambahan 3 unit alpahard facelift 2018 mendarat dengan selamat
1736,0,ini org wajib dipenjarakan wajib dilaporkanini org yang memecah belah
1737,0,tertawa diatas kebodohannya itu luar biasa gak malu sama sekali dan mungkin urat malunya sudah putus sedangkan kita pasti mikirnya duh malah ketawa bukannya mikir
1738,0,hai para penghujat kpopers aku pikir musik itu selera kaya makan mie instan kamu suka mie sedap aku suka indomie aku suka korean kalian suka pop yg dandut and more simpel sekali hanya masalah pilihan yg nyaman di telinga aja kok
1739,1,yah padahal asik main nexian messenger nxm dulu juga sempet chatingan bareng raditya dika wlwlw habis nexian koid terus beralih kemana bebe
1740,1,begitu mulianya tugas orang tua membesarkan anak mengemban amanah dari tuhan untuk menjaga mendidik menyayangi dan memelihara anak berilah ia cinta dan kebutuhan lahir dan batinnya
1741,1,senang begitu banga amat kayaknya
1742,0,iya nih anjing manusia pada lebay muak gua liatnya
1743,0,benarbenar merasa tidakenak tapi semua di luar kendali q apa yang salah ya
1744,1,penutup thread ini adalah saya mohon kamu selalu inget saya sayang kamu ilysm to the moon and never back thanks for everything saranghae
1745,0,sibuk semua nih pft
1746,0,baik kalau soal ham mau tanya koruptor waktu maling mikirkan hak orang lain ngak koruptor itu sendiri adalah pelanggar ham cuma koruptor yang bela koruptor politisi bebal
1747,0,kata salah satu temen dan merasa benarnya juga zaman sekarang baik dan dekat itu kalo butuh kecuali kenal lama kadang yg kenalnya udah lama gt juga sih hahaha
1748,1,cinta terhadap negara merupakan bentuk bela tanah air jadilah pahlawan untuk negara dalam bentuk manifestasi menghargai tamu negara yang sedang di undang negara kita
1749,1,gogilang haha gua kalo malem2 laper suka ksono beli nasi uduk enak apa lagi sambelnya
1750,1,positif thinking ajasusu kental manis ga susu nyabesok2 pasti koq susunyasama ky 2019ganti presidenskrg blom presidennya kan
1751,0,ah basi yang itu yang lain dong hahaha haruskah aku menjadi matahari biar bisa menyinarip harimu aea har
1752,1,kok banyak yg protes yeini pemain bagus buat sundulanbayangin kalo oezil samaxhaka kasih umpan lambung terus yang nyamber ini bocahmayan kaga
1753,1,sore kak rica_â sudah makan kan d semangat terus ya kak
1754,0,baca dm saya scroll message di tgl 4juli saya sudah kirim bukti resi untuk pengembalian ongkir tolonh dong sistemnya di perbaiki jgn tanya terus2an pdhl sya sudah kasih data lengkap
1755,1,aak suka banget feel sehabis nonton sama kayak the greatest showman ikut nyanyi pas dancing queen dan mamma mia dan dancing queen yg ini jauuh lebih asik drpd yg versi meryl streep di film pertama hehe rasanya mau balik nonton lagi
1756,1,tambah kece nya kalau cowok sholat jumat ï½âï½ï½
1757,0,miris marah jengkel gedeg saya jeng jkt baru 5 tahun dilola oleh orangorang baik hny dlm waktu 5 bulan dirusak oleh orangorang gila
1758,0,kepada yang terhormat mohon untuk di kroscek pemesanan saya nomor pemesanan sensitiveno karna sudah 3 hari status masih di merchant mohonditindaklanjut
1759,1,sempurna itu ya saya sama kamu jadian hehe ï½âï½
1760,0,enak ya metal bong bobok di hotel prodeo di pecat mak mega hahahahaha makanya jangan sok metal lo kelar hidup lo terjerat ott pdip pecat bupati purbalingga lewat
1761,1,wkwk malese talah contoh suudzon dalam cemburu gaberani duduk sebelahan ketika dia doi dan kamu mikirnya tuhkan knp sih gamau sebelahan pasti biar ga dikira nempel terus ma aq wkwkkwwk pdhl gr2 sebelahmu dah temen yg lain
1762,0,sakit leher karena salah bantal itu menyiksa ï½âï½ _âï½ï½
1763,1,banyak banget yang nanya pas tau di hape apps twitter emang masih jaman ya main twitter yaelah hari gini main twitter ngapain ngapain main twitter coba hehe cuman bs gt sih ya senyum aja kalo balik lagi main twitter
1764,0,hahaha yop aries keuangan budget untuk liburan masih kurang yah
1765,0,please min jaringan wifi telkom kok lemot sekali padahal masih serumah cuma beda lantai aja atas sama bawah kenapa signalnya ngilang2 mulu
1766,0,orang pesimis mengeluhkan tentang angin
1767,1,selamat pagi ibu selamat pagi ayah ure my beloved everything â i m
1768,0,aku jahat memang jahat tapi semua apa boleh buat ku berdosa sunguh dosa karena ku rampas kebahagianya
1769,1,bahahahahajahahhaa penyakit emangg udahh wkwkw tahan aja ampe agustus lisa dtg kekokas niatnya liat lisa ngeri ujungnya kemana mana
1770,0,memang goblok kau ini kafir saya bilang masyumi vs pki zaman soekarno soekarno yg membubarkan masyumi zaman soeharto masyumi di izinkan kembali he anjiang kurok ang lai bisa baco ang jiang
1771,0,sepi sekali jadi kangen rumah guling
1772,0,trending topic yang trendy banget pro dan kontra wajar tapi yg komen yg dilakuin doski itu cuma caper dan lebay malah nyalahin nganggep salahnya joget dangdut ente mungkin harus cek posisi otak sama pantat barangkali ketuker otak kok isinya full of shit viavallen
1773,1,dan untukmu qyaraku jaga selalu bahagia ibumu jaga selalu senyum diwajahnya senyum yg selalu aku rindukan krn kau tau skrng kau lah sumber bahagia untuk dirinya hanya kau lah dunianya skrng semuanya lasti dia lakukan untukmu aku percaya padamu sobat kecil
1774,1,happy anniv bil wkwkwk langgeng terus sama radiitt gila radit niat loh foto foto ucapan annivnyaa sampe dibantuin jg sama cewe2 disini
1775,1,permen banyak yang rasanya manis tapi juga yang rasanya asem jujur saya suka sangat sama permen yang manis
1776,0,53x plesiran anggota dpr dalam setahun sama dgn 7x lipat dana untuk pemberantasan korupsi reformasidpr httptcolvvhor6tfr
1777,0,oia mav lupa st malu soalnya susah nih jawaban ice cream sih
1778,1,alhamdulilahirabilalamin untuk seluruh ibu diseluruh dunia semoga selalu sehat wal afiat dan bahagia selalu semangat ibu
1779,0,pelayanan nya kurang memuaskaann commuterline krl_jabodetabek payaahh _
1780,0,jgn hanya tau korupsi lalu uangnya dihamburkan utk negara lain dprri anda semua adalah pemegang amanah rakyat oleh karena rakyat anda bisa bersuara lantang dan oleh karena rakyat anda bisa menjadi terhormat lalu apakah anda bisa menghormati amanah rakyat ingat dan camkan
1781,1,oldmoneygangerasain itu mengingatkan masa kejayaan tahun 90an dan beruntung bisa ngerasain jadi anak pada jamannya semua tweet isi kekonyolan itu udah aku rasain juga
1782,0,betul betul mbah sya juga heran kok masih profkyaidan buya yang mau dibawah rok siembok yang setahu saya selama sekolah tidak terdapat satupun tulisan ataupun artikel yang memuat jasa siembok terhadap negara
1783,0,kamu tidakada hak buat males ya pengkhianat
1784,0,bullshit mereka semua rakyat yang akan sebagai penentu nasib indonesia bukan pada para tokoh elit maupun tokoh parpol tapi pada kekuatan rakyat
1785,0,sudah lama tidaklanjutin drama tapi butir soal belum selesai ï½ ï½
1786,0,tau aja urang paling lemah kalo berhadapan sama si nadia sayang banget akutu ga bisa nolak maunya bocah satu itu nad im gon na miss you so badly
1787,1,saat tadi 2 sejoli menyepakati berucap ikrar untuk sehidup semati di hadapan keluarga dan orang tersayang tanpa merubah apa yang mereka yakini masingmasing kepada sang maha cinta dan di tempat lain akhirnya sepasang manusia kembali bersatu di dalam pelukannya
1788,1,lihat aku sayang yang sudah berjuang menunggu mu datang menjemputmu pulang ingat selalu sayang hati ku kau genggam aku tak akan pergi menunggu kamu disini
1789,1,nasi uduk bude mantab
1790,0,gue benci hutang tapi jujur juga belum bisa 100 lulus dari jeratannya masih seneng sm dunia tapi kalo bisnis udah pake uang yang kita aja belum tau laku berapa tapi udah mendahului allah bakal abis buat nutupin tu bisnis
1791,0,ilcbpip satu lagi travel meler katanya anti asing tp sok2 bicara pake gaya asingmulut baulalu ko bikin apa pak kiyai
1792,0,kurangin intensitas berkabar jadi tak berkabar tiap hari yakali tiap hari banget begadang cuman buat face time dan telponan dikantor tidur namanya juga perjuangan det ya engga gitu juga sih bejuang ga sekonyol itu juga saatnya lah
1793,0,kapan ea masalah nya cepat klar
1794,0,mules ape males he bagi bahri sama bagi memeng mau ke sini juga daripada dikau kesepian disana d mules bang hah
1795,0,gurl cma gara2 dia publishing chat sexual harassment dia yg menurut lu alay caper baper lu sampe bawa2 masa lalu dia are u fvcking kidding me pantes aja indonesia ini banyak org yg ngalami pelecehan seksual lebih pilih diam aja ya gmna netizen macam lu masih banyak
1796,0,hallo mohon dibantu ya saya sudah menyerah dengan pengaduan saya di kantor cabang sabang jakarta pusatsaya lapor tanggal 2 mei 2018dimana masalahnya adalah ketika tarik tunai rekening terdebet tapi uang tidak keluarkatanya 14 hari kerja tapi sampe sekarang nihil
1797,0,untung ga yg nanggepin mayan malu kan kalo ngomong di grup ga yg nanggepin kadang kalo g yg nanggepin berati orang2 udah ngerti apa yg kamu maksud ga tujuan kamu ngomong seperti itu not funny to discuss sis perlu dipertanyakan lagi maksud amp
1798,0,deh coba itu st tidakboleh sudah tua oper lah pengen ni haha siapa saja kost pak
1799,1,mata najwa keren banget metro_tv
1800,1,iya calon ipa mah beda iya untung saya pintar ya vionaribka
1801,0,dan lebihnya speak up itu dikatain lebay cari sensasi dsb mereka ga mikir kalo mau speak up itu butuh keberanian karna sebenernya pelecehan itu aib tp kalo ga speak up itu orang jg ga bakal jera ga ngerasa mal
